[{"argument_graph_id":"ag_sepsis_bl_conflict","arguments":[{"certainty":"moderate","conclusion":"administer beta_lactam","id":"arg_recommend_bl","premises":["dx_sepsis","adult_patient"],"source_rule":"rule_sepsis_bl_recommend","strength":"strong"},{"certainty":"high","conclusion":"withhold beta_lactam","id":"arg_contraindicate_bl","premises":["allergy_history_beta_lactam_anaphylaxis"],"source_rule":"rule_bl_anaphylaxis_contra","strength":"strong"},{"conclusion":"beta_lactam reduces mortality","evidence_type":"meta_analysis","id":"arg_evidence_rct","premises":["meta_analysis_rr_0.75"]}],"attack_edges":[{"attack_type":"rebut","description":"Contraindication rebuts recommendation for allergic patients","from":"arg_contraindicate_bl","to":"arg_recommend_bl"}],"defeat_edges":[{"defeat_status":"unresolved","description":"Contraindication defeats recommendation (priority unresolved in source)","from":"arg_contraindicate_bl","to":"arg_recommend_bl"}],"extension_summaries":[{"accepted":["arg_contraindicate_bl","arg_evidence_rct"],"rationale":"Grounded extension rejects attacked argument without defense","rejected":["arg_recommend_bl"],"semantics":"grounded"}],"source_span_ids":["span_rec_sepsis_bl","span_contra_bl_allergy","span_evidence_sepsis","span_allergy_history"],"support_edges":[{"description":"RCT meta-analysis supports beta-lactam recommendation","from":"arg_evidence_rct","support_type":"evidential","to":"arg_recommend_bl"}],"undercut_edges":[]}]
